{
  "$schema": "./virgilio/schema/virgilio.config.schema.json",
  "_README": "virgilio's config: the SSOT for what the docs-reality gate enforces. Changing the repo's reality without updating this file (or vice versa) makes the gate fail — that's intentional. Notes: (1) CHANGELOG.md is fully historical; (2) DEVELOPMENT_ROADMAP from '## Version History' is a historical zone; the README has no changelog since v4.8.1 (release notes live only in CHANGELOG.md, per SSOT); (3) no guards: the release flow is tag→PyPI (external tier), not probeable via remote-tracking refs — deploy honesty is audited in §9; (4) the MCP tool count (28) is NOT mechanized: tool files (23) ≠ @mcp.tool registrations (28), and a wrong-proxy rule is worse than none — it stays with the §9 audit; (5) DEVELOPMENT_ROADMAP.md is git-ignored ('internal development files'): it stays in docsGlobs/historicalSections for LOCAL coverage (in CI it simply doesn't exist → fewer files scanned), but it must NOT be in statusDocs (a missing statusDoc is a Finding → red CI). The CI-enforced status doc is CLAUDE.md.",

  "root": ".",
  "docsGlobs": [
    "CLAUDE.md",
    "README.md",
    "CHANGELOG.md",
    "DEVELOPMENT_ROADMAP.md",
    "CONTRIBUTING.md",
    "SECURITY.md",
    "DOC_GOVERNANCE.md"
  ],
  "adapters": ["filesystem", "git"],
  "prodBranch": "main",
  "prodRef": "origin/main",

  "factKeys": ["unit-test-files", "integration-test-files"],
  "reality": {
    "counts": [
      {
        "fact": "unit-test-files",
        "owner": "CLAUDE.md",
        "adapter": "filesystem",
        "capability": "count",
        "query": { "glob": "tests/unit/test_*.py" }
      },
      {
        "fact": "integration-test-files",
        "owner": "CLAUDE.md",
        "adapter": "filesystem",
        "capability": "count",
        "query": { "glob": "tests/integration/test_*.py" }
      }
    ]
  },

  "statusDocs": ["CLAUDE.md"],
  "statusVocabulary": ["current", "draft", "superseded"],

  "historicalPaths": ["CHANGELOG.md"],
  "historicalSections": [
    { "file": "DEVELOPMENT_ROADMAP.md", "fromHeadingRegex": "^##\\s+Version History" }
  ],

  "guards": [],

  "forbiddenPhrases": [
    {
      "pattern": "google-genai\\s*>=\\s*1\\.",
      "flags": "i",
      "reason": "the SDK requirement is google-genai>=2.0.0 since v4.4.0 (Interactions 'steps' schema); citing 1.x as the requirement reproduces the legacy-schema 400 (drift observed twice: v4.4.1 fix + CLAUDE.md header found stale on 2026-07-05)",
      "since": "2026-06-12"
    },
    {
      "pattern": "deep-research-pro-preview",
      "flags": "i",
      "reason": "model removed upstream (404), replaced by deep-research-preview-04-2026 in v4.4.0; citing it as current is stale. Allowed only in historical zones or with the allow-marker",
      "since": "2026-06-12"
    },
    {
      "pattern": "\\b\\d+\\s+(unit\\s+|integration\\s+)?tests?\\s+(passing|pass|green)\\b",
      "flags": "i",
      "reason": "hardcoded test-pass counts drift on every commit (103→174→187 between v4.0.1 and v4.6.0, found stale on 2026-09-19); run pytest for the number, never write it. Allowed in historical zones (CHANGELOG, README Changelog)",
      "since": "2026-09-19"
    },
    {
      "pattern": "mcp\\[cli\\]\\s*>=\\s*1\\.0\\.0(?!\\s*,\\s*<\\s*2)",
      "flags": "i",
      "reason": "mcp 2.x (2026-09-07) renamed FastMCP → MCPServer; an unpinned >=1.0.0 resolves to 2.x and the server exits at import (fresh installs of 4.0.0–4.6.1 broken; caught by CI on 2026-09-19). Cite the pin: mcp[cli]>=1.0.0,<2",
      "since": "2026-09-19"
    },
    {
      "pattern": "veo-\\d(\\.\\d)?-(fast-|lite-)?generate",
      "flags": "i",
      "reason": "Veo 3.1 Preview was shut down in the Gemini API on 2026-10-22 (Veo 2/3.0 earlier); citing a Veo model ID as usable is stale. Video runs on Gemini Omni Flash since v4.8.0. Allowed in historical zones or with the allow-marker",
      "since": "2026-10-25"
    }
  ],

  "links": { "checkRelativeIntraRepo": true },

  "audit": { "probes": [] }
}
